{
  "$schema": "../schema/entry.schema.json",
  "slug": "backstage",
  "name": "Backstage",
  "vendor": "Backstage (CNCF)",
  "category": "dev-portal",
  "website": "https://backstage.io",
  "documentation_url": "https://backstage.io/docs/integrations/github/github-apps/",
  "own_app": "optional",
  "supports": {
    "user": false,
    "org": true,
    "enterprise": false,
    "ghes": true
  },
  "install_scope": {
    "repositories": "either",
    "level": "org",
    "notes": "Backstage only respects organization-wide installs, and only one Backstage app per organization."
  },
  "credentials_needed": [
    "app_id",
    "client_id",
    "client_secret",
    "webhook_secret",
    "private_key"
  ],
  "two_step_webhook": false,
  "manual_steps": [
    "Generate a private key and store the app ID, client ID, client secret, webhook secret and key in a YAML file included from app-config.yaml; never commit it.",
    "Install the app on the organization. Only an organization owner can do this."
  ],
  "notes": "Backstage doesn't use the webhook. Its CLI (create-github-app) only works on github.com; on GitHub Enterprise Server create the app manually. Pick the variant for the features you use: the docs list extra permissions for publishing software templates.",
  "manifest": {
    "name": "Backstage",
    "url": "https://backstage.io",
    "hook_attributes": {
      "url": "https://example.invalid/webhook-not-used",
      "active": false
    },
    "public": false,
    "default_permissions": {
      "contents": "read",
      "members": "read",
      "metadata": "read",
      "statuses": "read"
    },
    "default_events": []
  },
  "variants": [
    {
      "id": "catalog",
      "name": "Software catalog",
      "description": "Reading software components and organization data.",
      "default_permissions": {
        "contents": "read",
        "members": "read",
        "metadata": "read",
        "statuses": "read"
      },
      "default_events": []
    },
    {
      "id": "templates",
      "name": "Catalog and software templates",
      "description": "Also publishing software templates: creating repositories, pull requests and issues.",
      "default_permissions": {
        "administration": "write",
        "contents": "write",
        "issues": "write",
        "members": "read",
        "metadata": "read",
        "pull_requests": "write",
        "statuses": "read"
      },
      "default_events": []
    },
    {
      "id": "templates-full",
      "name": "Templates with workflows, variables, secrets and environments",
      "description": "Only if your templates create GitHub workflows, Actions variables, Actions secrets or environments.",
      "default_permissions": {
        "actions_variables": "write",
        "administration": "write",
        "contents": "write",
        "environments": "write",
        "issues": "write",
        "members": "read",
        "metadata": "read",
        "pull_requests": "write",
        "secrets": "write",
        "statuses": "read",
        "workflows": "write"
      },
      "default_events": []
    }
  ],
  "last_verified": null,
  "verified_by": null,
  "verification": {
    "status": "needs-review",
    "method": "doc-hash",
    "doc_hash": null
  },
  "changelog": [
    {
      "date": "2026-10-15",
      "version": "1.0.0",
      "author": "zmckenzie",
      "summary": "Initial entry from the vendor's documentation, read on 2026-10-15. Awaiting maintainer verification."
    }
  ]
}
