{
  "$schema": "../schema/entry.schema.json",
  "slug": "atlantis",
  "name": "Atlantis",
  "vendor": "Atlantis",
  "category": "iac",
  "website": "https://www.runatlantis.io",
  "documentation_url": "https://www.runatlantis.io/docs/access-credentials",
  "documentation_urls": [
    "https://www.runatlantis.io/docs/configuring-webhooks"
  ],
  "own_app": "optional",
  "supports": {
    "user": true,
    "org": true,
    "enterprise": false,
    "ghes": true
  },
  "install_scope": {
    "repositories": "either",
    "level": "org-or-user",
    "notes": "Atlantis supports only one installation per GitHub App."
  },
  "credentials_needed": [
    "app_id",
    "installation_id",
    "private_key",
    "webhook_secret"
  ],
  "two_step_webhook": true,
  "manual_steps": [
    "Set the webhook URL to https://<your Atlantis host>/events and set a webhook secret; pass the same secret to Atlantis with --gh-webhook-secret.",
    "Generate a private key and start Atlantis with --gh-app-id and --gh-app-key-file (add --gh-installation-id if you created the app by hand)."
  ],
  "notes": "Atlantis can also create the app itself at https://<your Atlantis host>/github-app/setup. The webhook events come from Atlantis's webhook page. Administration (v0.19.7), Members (v0.22.3) and Actions (v0.30.0) were added later: apps created earlier don't have them.",
  "manifest": {
    "name": "Atlantis",
    "url": "https://www.runatlantis.io",
    "hook_attributes": {
      "url": "https://example.invalid/replace-with-your-webhook-url",
      "active": true
    },
    "public": false,
    "default_permissions": {
      "actions": "read",
      "administration": "read",
      "checks": "write",
      "contents": "write",
      "issues": "write",
      "members": "read",
      "metadata": "read",
      "pull_requests": "write",
      "repository_hooks": "write",
      "statuses": "write"
    },
    "default_events": [
      "issue_comment",
      "pull_request",
      "pull_request_review",
      "push"
    ]
  },
  "last_verified": null,
  "verified_by": null,
  "verification": {
    "status": "needs-review",
    "method": "doc-hash",
    "doc_hash": null
  },
  "changelog": [
    {
      "date": "2026-10-15",
      "version": "1.0.0",
      "author": "zmckenzie",
      "summary": "Initial entry from the vendor's documentation, read on 2026-10-15. Awaiting maintainer verification."
    }
  ]
}
